job_title,company_name,location,job_type,experience_level,education_req,salary_range,job_requirements,job_responsibilities,industries,job_function,applicant_count,posted_date,source_platform,source_url,scraped_at
Senior Software Engineer,McEasy,Surabaya,,Senior tingkat menengah,,Tidak Dicantumkan,"Requirements Possess 3-5 years of experience in software development Proficient to advance in at least one modern programming language (e.g., Python, Java, Go, C++, Rust, or JavaScript/TypeScript) Hands-on experience deploying applications on Kubernetes Able to implement at minimum of unit testing / TDD approach Deep understanding of DB systems (Indexing Normalization/Denormalization) Experience implementing Rust is a plus Strong understanding of methodologies and algorithms Job Descriptions Identify, analyze, and resolve critical issues that have a significant impact on the company’s engineering operations or customer satisfaction Create detailed documentation of solutions, processes, and learnings to ensure knowledge is retained and shared across the organization Research and implement c","McEasy is a forward-thinking B2B SaaS company providing innovative telematics and logistic solutions. We are committed to delivering high-quality, reliable software solutions to our clients and seek a skilled and passionate Software Engineer Requirements Possess 3-5 years of experience in software development Proficient to advance in at least one modern programming language (e.g., Python, Java, Go, C++, Rust, or JavaScript/TypeScript) Hands-on experience deploying applications on Kubernetes Able","Teknologi, Informasi, dan Internet, Transportasi, Logistik, Rantai Pasokan, dan Penyimpanan",Rekayasa,,2026-02-18,LinkedIn,https://id.linkedin.com/jobs/view/senior-software-engineer-at-mceasy-4360481257,2026-03-04 18:56:18
Sr. Software Engineer (Mobile),PT Sentra Vidya Utama (SEVIMA),Surabaya,,Senior tingkat menengah,,Tidak Dicantumkan,"Requirements: Pengalaman kuat dalam membangun aplikasi PWA (end-to-end). Mampu melakukan proses build, deploy, dan submission aplikasi mobile (Android & iOS). Menguasai Kotlin (Android) dan Swift (iOS). Memahami konsep CI/CD, automation, dan manajemen code repository. Familiar dengan prinsip code structuring dan code cleanliness. Memiliki kemampuan problem-solving dan inisiatif tinggi dalam pengembangan fitur. Mampu bekerja secara mandiri dan cepat beradaptasi dengan proyek baru. Show more Show less","Responsibilities: Mengembangkan aplikasi mobile menggunakan PWA, Kotlin, dan/atau Swift. Melakukan proses build, deploy, dan publish aplikasi ke Apple App Store dan Google Play Store. Menyusun struktur kode yang bersih, efisien, dan mudah di-maintain. Menerapkan praktik terbaik dalam automation, CI/CD pipeline, serta version control (Git). Berkolaborasi dengan tim backend, UI/UX, dan QA untuk memastikan kualitas aplikasi. Menganalisis dan memperbaiki bug atau isu performa pada aplikasi. Requirements: Pengalaman kuat dalam membangun aplikasi PWA (end-to-end). Mampu melakukan proses build, deploy, dan submission aplikasi mobile (Android & iOS). Menguasai Kotlin (Android) dan Swift (iOS). Memahami konsep CI/CD, automation, dan manajemen code repository. Familiar dengan prinsip code structurin",Pengembangan Perangkat Lunak Khusus Sistem TI,"Rekayasa, Teknologi Informasi",25,2026-02-18,LinkedIn,https://id.linkedin.com/jobs/view/sr-software-engineer-mobile-at-pt-sentra-vidya-utama-sevima-4374491031,2026-03-04 18:56:22
Software Engineer (Frontend),McEasy,Surabaya,,Asosiasi,,Tidak Dicantumkan,"Qualifications Min. 1 year of experience in front end development Strong Proficiency in Javascript & Typescript Deep experience at least one of the framework: Vue.js, Nuxt.js, React Knowledge of responsive design & system theme Experience integrating with RESTful APIs or GraphQL Good understanding about front end performance optimization Placement: Surabaya 🚀 Ready to shake up the tech scene? Dive into our vibrant team where your voice matters! Jumpstart your journey and join us in crafting the future of tech. Apply today to spark change and fuel innovation! 🌟 Show more Show less","McEasy is a forward-thinking B2B SaaS company providing innovative telematics and logistic solutions. We are committed to delivering high-quality, reliable software solutions to our clients and seek a skilled and passionate Software Engineer Job Description Design, develop, and maintain high-quality, scalable frontend applications Translate product requirements and UI/UX designs into clean, efficient, and maintainable code Ensure frontend applications meet performance, accessibility, and reliabi",Pengembangan Perangkat Lunak,"Desain, Manajemen Proyek, Teknologi Informasi",,2026-02-10,LinkedIn,https://id.linkedin.com/jobs/view/software-engineer-frontend-at-mceasy-4354424695,2026-03-04 18:56:28
Mobile Lead,Geniebook,Surabaya,,Senior tingkat menengah,,Tidak Dicantumkan,"Qualifications 7+ years in mobile development, including 5+ years strong expertise in iOS (Swift, Objective-C, SwiftUI, UIKit) Proven track record leading mobile teams in startups/scale-ups building consumer apps Proficient in clean architecture (MVVM, VIPER), state management, and handling complexities like authentication, payment gateways (Midtrans/Xendit), and real-time features (WebSocket) Additional Skills (Nice-to-Have): Experience/knowledge in Android (Kotlin/Jetpack Compose) Experience in TDD Experience in Pair Programming Others Excellent problem-solving and ownership mindset; thrives in fast-paced startups Collaborative communicator, able to communicate in English for cross-team/global work Show more Show less","Responsibilities: Lead the mobile team (3 members) in building and maintaining scalable, user-friendly iOS/Android apps Hands-on development to improve iOS/iPadOS app Design mobile app architecture with high standards, including backend integration (APIs, Firebase), push notifications, and offline sync for seamless learning Implement iOS best practices (SwiftUI, Combine, Core Data) and ensure cross-platform compatibility where needed Collaborate with Product, Design, and Backend teams to build features Conduct code reviews, mentor team members, and enforce quality via CI/CD, automated testing, and performance optimization Job Qualifications 7+ years in mobile development, including 5+ years strong expertise in iOS (Swift, Objective-C, SwiftUI, UIKit) Proven track record leading mobile team",Penyedia Jasa Pembelajaran Online,Teknologi Informasi,60,2026-02-04,LinkedIn,https://id.linkedin.com/jobs/view/mobile-lead-at-geniebook-4368572011,2026-03-04 18:56:33
Japanese Speaking Sales Administration Executive,JAEGGI,Surabaya,,Tingkat pemula,,Tidak Dicantumkan,"requirements. Strong data entry and record‑keeping capability with attention to detail. Good analytical skills to interpret order metrics and improve processes. Strong organizational and multitasking abilities in a fast-paced environment. Must be a strong team player and customer-oriented professional with excellent communication, analytical, organizational, and relationship management skills. What We Offer An open corporate culture Exciting projects with creative freedom, short decision-making processes An attractive remuneration package Corporate benefits with various providers Show more Show less","Responsibilities Support financial team with accounts receivable reminder and collection. Other ad hoc duties assigned. Your Skills Excellent command of both spoken and written Japanese and English is essential, to effectively support our Japanese client portfolio. Bachelor’s degree or Diploma in Business Administration, Supply Chain Management, Logistics, or related field preferred. 2–5 years of experience in order management, sales support, administration, or import/export management. Proficiency in Microsoft Office (especially Excel for reports) and CRM software (e.g., Salesforce). Understanding of Incoterms and international trade documentation requirements. Strong data entry and record‑keeping capability with attention to detail. Good analytical skills to interpret order metrics and i",Manufaktur Mesin,"Penjualan, Pengembangan Bisnis",,2026-02-06,LinkedIn,https://id.linkedin.com/jobs/view/japanese-speaking-sales-administration-executive-at-jaeggi-4361414199,2026-03-04 18:56:38
Web Engineer (Contract Based),Kalbe Nutritionals (PT Sanghiang Perkasa),Jakarta Timur,,Tingkat pemula,,Tidak Dicantumkan,"Requirements Bachelor Degree in Information System or related field Have min. 1 years Experience in Web Engineer Technical tools : C#/VB Programming Language, .Net, Framework, .NetCore Framework, Entity, Framework (EF), ADO .NET, Javascript, Jquery,SQL & NoSQL Database, Oracle Database, Rest, API, UI/UX Development Preferable has experinece in Front End Development (Ex.ReactJs, VueJS, ReactNetcore, etc) and Back End Development (Ex. .Net, .NetCore,Pyhton etc) Has drive for result attitude & innovation Willing to be placed at Pulogadung, East Jakarta Show more Show less","Responsibilities Develop, modify, and/or enhance applications in accordance with the IT Product functional specifications, while adhering to established standards, internal Software Development Guidelines, and Software Development Security Policies. Perform System Internal Testing to ensure the application is free from bugs and functional errors, and carry out necessary fixes before handover to the IT Product team. Prepare and maintain comprehensive and well-structured technical documentation to support future development and maintenance activities. Execute the development process in accordance with agreed standards, procedures, and timelines to support smooth business operations. Requirements Bachelor Degree in Information System or related field Have min. 1 years Experience in Web Engine",Jasa Penyedia Makanan dan Minuman,"Rekayasa, Teknologi Informasi",78,2026-02-25,LinkedIn,https://id.linkedin.com/jobs/view/web-engineer-contract-based-at-kalbe-nutritionals-pt-sanghiang-perkasa-4376765187,2026-03-04 18:56:46
Accounts Payable - Finance,Shopee,"Jakarta Raya, Indonesia",,Tingkat pemula,,Tidak Dicantumkan,"Requirements Bachelor’s degree in Accounting, Finance, or a related field. 1–3 years of experience in Accounts Payable or a similar role (fresh graduates with internships in accounting). Strong understanding of accounting principles and invoice verification processes. Detail-oriented with high accuracy and good analytical skills. Proficient in Microsoft Excel and accounting software (e.g., SAP, Oracle, or similar). Good communication and teamwork skills. Show more Show less","Job Description Verify the accuracy and completeness of invoices, supporting documents, and payment requests Check that invoices comply with company policies, purchase orders, and approval hierarchies. Match invoices with purchase orders and goods receipt notes (3-way matching). Ensure all invoice details (amount, tax, vendor information, etc.) are correct before entries. Record and make entries of invoices into the accounting system accurately and on time. Coordinate with users from other teams","Platform Marketplace Internet, Teknologi, Informasi, dan Internet","Keuangan, Akuntansi/Audit",,2026-02-12,LinkedIn,https://id.linkedin.com/jobs/view/accounts-payable-finance-at-shopee-4355202218,2026-03-04 18:56:50
Accounting Staff,PT Alam Sutera Realty Tbk.,Kota Tangerang,,Asosiasi,,Tidak Dicantumkan,"Requirements : Minimum Bachelor Degree of Accounting, from reputable university. Have min. 1 year experience in Accounting Able to work with a minimum supervision while understanding the necessity for communicating and coordinating work efforts with other employees and organizations. Strong work ethic and emphasis on attention to details. Analytical problem solving ability. Ability to work well under pressure and within short deadlines. Good in English both spoken and written. Willing to be placed at Alam Sutera, Tangerang Show more Show less","Job Descriptions : Create detailed journal entries and post them to the general ledger (GL) to track all income statements and expenses Handle all accounts payable and receivable on a daily basis to make sure each invoice and expense report is accurate Enter financial data into computer software, making sure all bills and invoices are filed correctly Prepare for quarterly reporting using standard best practices and assist in monthly closings Job Requirements : Minimum Bachelor Degree of Accounti",Real Estat,Akuntansi/Audit,,2026-02-26,LinkedIn,https://id.linkedin.com/jobs/view/accounting-staff-at-pt-alam-sutera-realty-tbk-4378368616,2026-03-04 18:56:56
Junior Fullstack Developer,PT. Metrodata Electronics Tbk.,Jakarta,,Tingkat pemula,,Tidak Dicantumkan,Requirements Bachelor’s Degree in Computer Science / Information Technology or related fields Minimum GPA 3.00 out of 4.00 Fresh graduates are welcome to apply Have basic knowledge of Java / .Net / Angular Have strong willingness to learn and a good teamwork mindset Then this opportunity might be for you. Show more Show less,"Responsibilities Supporting application development and system integration activities. Collaborating with senior developers in design, development, testing, and deployment phases. Assisting in troubleshooting, debugging, and improving application performance. Participating in project discussions and continuously enhancing your technical capabilities. Your goal will be to work with internal teams to design, develop, and maintain software while gaining hands-on experience in enterprise-level projects. Requirements Bachelor’s Degree in Computer Science / Information Technology or related fields Minimum GPA 3.00 out of 4.00 Fresh graduates are welcome to apply Have basic knowledge of Java / .Net / Angular Have strong willingness to learn and a good teamwork mindset Then this opportunity might",Layanan dan Teknologi Informasi,"Rekayasa, Teknologi Informasi",,2026-02-05,LinkedIn,https://id.linkedin.com/jobs/view/junior-fullstack-developer-at-pt-metrodata-electronics-tbk-4369119207,2026-03-04 18:57:00
Accounting Associate,Acclime,Jakarta Selatan,,Asosiasi,,Tidak Dicantumkan,"requirements. Your responsibilities will include preparing financial statements, performing tax reconciliations, assisting with payment processes, and ensuring compliance with applicable accounting and tax regulations. This position offers valuable exposure to a diverse client portfolio across various industries, providing strong learning opportunities and professional growth. It is an excellent opportunity for a motivated and detail-oriented accounting professional who is eager to develop technical expertise while working in a dynamic, client-focused environment. What you'll be doing Gathering and filling daily operational and financial data such as: sales invoice to customer, supplier invoices, bank statements and etc. Prepare client’s monthly financial statements including Balance Sheet","responsibilities will include preparing financial statements, performing tax reconciliations, assisting with payment processes, and ensuring compliance with applicable accounting and tax regulations. This position offers valuable exposure to a diverse client portfolio across various industries, providing strong learning opportunities and professional growth. It is an excellent opportunity for a motivated and detail-oriented accounting professional who is eager to develop technical expertise while working in a dynamic, client-focused environment. What you'll be doing Gathering and filling daily operational and financial data such as: sales invoice to customer, supplier invoices, bank statements and etc. Prepare client’s monthly financial statements including Balance Sheet, Profit & Loss sta",Konsultan dan Jasa Bisnis,Akuntansi/Audit,136,2026-03-03,LinkedIn,https://id.linkedin.com/jobs/view/accounting-associate-at-acclime-4379167441,2026-03-04 18:57:05
Software Engineer,Alturian Indonesia,Jakarta,,Tingkat pemula,,Tidak Dicantumkan,"Requirements Technical Skills Minimum of 1–2 years of professional working experience as a Software Engineer. Demonstrated strong proficiency in PHP (CodeIgniter or Laravel) and JavaScript, with mandatory experience in Angular. Familiarity with React Native will be considered an added advantage. Hands-on experience with MVC frameworks (e.g., Laravel) and JavaScript libraries/frameworks. Solid understanding of MySQL and relational database design (one-to-many, many-to-many relationships, transactions). Familiar with Git for version control. Ability to build reporting and filtering features (search, data filters, export to Excel/PDF/CSV). Knowledge of inventory management fundamentals (stock in/out, auto stock updates during transactions). Experienced in API integration with third-party serv","Responsibilities Develop and maintain websites and web applications, including back-end (APIs, databases) and front-end (interfaces, tools). Ensure projects are delivered according to specifications. Collaborate with developers and cross-functional teams throughout the software development lifecycle. Support and maintain existing client platforms. Implement responsive designs provided by the design team. Requirements Technical Skills Minimum of 1–2 years of professional working experience as a Software Engineer. Demonstrated strong proficiency in PHP (CodeIgniter or Laravel) and JavaScript, with mandatory experience in Angular. Familiarity with React Native will be considered an added advantage. Hands-on experience with MVC frameworks (e.g., Laravel) and JavaScript libraries/frameworks. So",Perusahaan Induk,"Rekayasa, Teknologi Informasi",58,2026-02-13,LinkedIn,https://id.linkedin.com/jobs/view/software-engineer-at-alturian-indonesia-4371785505,2026-03-04 18:57:14
Business Analyst,Odoo,Kota Tangerang,,Asosiasi,,Tidak Dicantumkan,"requirements. Our Business Analyst will also support the development of our partner network (implementation partners) from various countries through coaching aimed at preparing them to become Odoo experts capable of implementing customer solutions according to established standards. You will have the opportunity to collaborate directly with Medium Market & Corporate companies, with larger-scale projects and long-term business engagements. The objective of the Business Analyst in such situations remains to implement, provide training, and deliver solutions that meet professional standards. A variety of different projects will become part of your portfolio as an Odoo's Business Analyst. Be prepared for hands-on experience starting from your first week with us! Your responsibilities include:","responsibilities include: Implement Odoo software: provide appropriate training and functional support for customers Analyze customer needs and suggest suitable solutions before entering the implementation phase (configuration & development) Project management: planning, forecasting, documenting, monitoring, and implementing Odoo software, followed by further action follow-ups Collaborate with Odoo developers to meet more specific implementation needs and with the Odoo Sales team regarding pre- and post-sales Support the development of our partner network to become Odoo Experts What's great in the job? Intensive certified functional training (Odoo certified) Full control over the projects you handle Rapid growth and extensive learning opportunities Wide-ranging application experience: CRM,",Pengembangan Perangkat Lunak,"Analis, Manajemen Proyek",,2026-02-20,LinkedIn,https://id.linkedin.com/jobs/view/business-analyst-at-odoo-4368170921,2026-03-04 18:57:18
Sr Officer-Service & Device Operations,PT. Indosat Tbk,"Jakarta Raya, Indonesia",,Senior tingkat menengah,,Tidak Dicantumkan,"Qualification Minimum bachelor’s degree in Telecommunication Engineering or IT Engineering. Related Experience 5 years of experience in Core/RAN Performance or CORE/RAN Network Operation. Skills Excellence Communication Skills. Basic Knowledge in End-to-End of Telecommunication Domain. Basic Understanding of Customer Experience Management. Have technical knowledge in RAN, Core and other domains / surrounding components (e.g. IMS, Radio, Interface & Signaling). Having Data Analytics knowledge (statistical analysis, statistical tools, methods/processes to analyze data, data correlation). Hands-on with Business Intelligence Tools (e.g. Tableau, Power BI & etc.) Relevant professional certifications (e.g., 5G/IMS/RAN/device testing certifications) are an advantage. Experience working with OEMs/","Role Purpose Manage end-to-end Service & Device operations—including testing, escalation handling, performance analysis, issue tracking, and partner coordination—to ensure seamless and reliable customer experience across smartphones, FWA devices, CPEs, and other connected devices. Job Description DEVICE OPERATIONS (Technical Execution) Perform device testing all cover B2C & FWA (smartphone, FWA/CPE, router). Validate New firmware/software updates and patches Including Pre Test Conduct SIM & eSIM",Telekomunikasi,"Lainnya, Teknologi Informasi, Manajemen",143,2026-03-01,LinkedIn,https://id.linkedin.com/jobs/view/sr-officer-service-device-operations-at-pt-indosat-tbk-4379560300,2026-03-04 18:57:23
Quality Assurance,PT. Metrodata Electronics Tbk.,Jakarta,,Tingkat pemula,,Tidak Dicantumkan,"Requirements Fresh Graduate, Bachelor's Degree in Computer Science / Information Technology. Basic understanding of IT Support Application / IT Tester Application / IT Mobile App Tester (through projects, internships, or final thesis). Familiar with running and testing Mobile Applications and Web Applications. Basic knowledge of Mobile Apps and Web Apps. Basic knowledge of automation testing tools such as Katalon, JMeter, Selenium, etc. Proficient in Microsoft Excel (Graphic Charting, VLOOKUP, Pivot Table). Able to work in a team, communicative, and highly motivated to lear. Show more Show less","Responsibilities Testing / Pass-Fail Running Mobile Banking Application and internet banking Application base on SOP and Standard Template Scripting. Running Test with Mobile Device App and Web Apps. Technical Writer and Documentation result for Application Tester. Running Test with automation software. Requirements Fresh Graduate, Bachelor's Degree in Computer Science / Information Technology. Basic understanding of IT Support Application / IT Tester Application / IT Mobile App Tester (through projects, internships, or final thesis). Familiar with running and testing Mobile Applications and Web Applications. Basic knowledge of Mobile Apps and Web Apps. Basic knowledge of automation testing tools such as Katalon, JMeter, Selenium, etc. Proficient in Microsoft Excel (Graphic Charting, VLOOK",Layanan dan Teknologi Informasi,Jaminan Kualitas,,2026-02-16,LinkedIn,https://id.linkedin.com/jobs/view/quality-assurance-at-pt-metrodata-electronics-tbk-4372517750,2026-03-04 18:57:29
IT Project Manager (Intern),Shopee,"Jakarta Raya, Indonesia",,Magang,,Tidak Dicantumkan,"requirements from internal stakeholders Support the creation and maintenance of project documentation (e.g., project plans, meeting notes, timelines, reports) Help coordinate internal meetings, track action items, and follow up on project deliverables Support preparation of materials for project updates and stakeholder presentations Participate in internal testing (UAT/SIT) by compiling test scenarios and collecting feedback Assist in project closure tasks, including handover documentation and reporting Assist with stock checks, asset tagging, and logistics arrangements with vendors or internal teams Ensure proper documentation and compliance for asset issuance, movement, and decommissioning Work with the IT team to optimize asset usage, procurement cycles, and inventory accuracy Requireme","About The Team We are looking for a highly motivated IT Project Manager Intern to support our Corporate IT team in managing internal IT projects, asset tracking, and logistical coordination. This role is designed to alleviate administrative project workloads while offering valuable learning experiences in project coordination, IT operations, and asset lifecycle management. The intern will assist in various support functions across project documentation, communication, and logistics to ensure smo","Platform Marketplace Internet, Teknologi, Informasi, dan Internet",Teknologi Informasi,,2026-03-02,LinkedIn,https://id.linkedin.com/jobs/view/it-project-manager-intern-at-shopee-4360230121,2026-03-04 18:57:35
Finance & Accounting Admin - MODA,PT Astra International Tbk,Jakarta,,Senior tingkat menengah,,Tidak Dicantumkan,"Persyaratan Pendidikan minimal D3/S1 di bidang Akuntansi, Keuangan, atau bidang terkait. Memiliki pengalaman minimal 2-5 tahun di posisi serupa. Menguasai prinsip dasar akuntansi dan keuangan. Mampu mengoperasikan Microsoft Office (Excel, Word, dan PowerPoint). Pengalaman menggunakan software akuntansi (SAP). Memiliki pengetahuan tentang perpajakan. Teliti, detail-oriented, dan memiliki kemampuan problem solving yang baik. Multitasking dan memiliki kemampuan komunikasi yang baik. Memiliki integritas tinggi dan mampu menjaga kerahasiaan data perusahaan. Show more Show less","Deskripsi Pekerjaan Menyusun dan melakukan pencatatan laporan keuangan bulanan dan tahunan sesuai standar akuntansi yang berlaku. Mengelola akun piutang (Account Receivable/AR), termasuk penagihan dan rekonsiliasi pembayaran dari pelanggan. Mengelola akun utang (Account Payable/AP), termasuk verifikasi invoice dan pembayaran kepada vendor. Melakukan pencatatan, monitoring, dan pengelolaan aset tetap perusahaan, termasuk perhitungan depresiasi. Menyusun dan mengelola laporan perpajakan (PPN, PPh)",Manufaktur Mesin Automasi,"Akuntansi/Audit, Keuangan",,2026-02-02,LinkedIn,https://id.linkedin.com/jobs/view/finance-accounting-admin-moda-at-pt-astra-international-tbk-4368412445,2026-03-04 18:57:41
